{
  "schema_version": "1.0.0",
  "name": "demo-search-agent",
  "description": "Simple demo agent using the search tool",
  "model": "gpt-4",
  "temperature": 0.5,
  "instructions": "You surface search results for the user query.",
  "tools": [
    {
      "name": "default-search",
      "type": "search",
      "config": {
        "provider": "mock"
      },
      "allowed_hosts": ["example.com"]
    }
  ],
  "triggers": ["manual"]
}
